114;Towards Agile Scalability Engineering;5/24/2018 12:15 PM;5/24/2018 12:30 PM;Research;;Scalability engineering is currently not well integrated into agile de- velopment techniques. By scalability we mean the ability of a system to handle increasing workload. This paper extends agile development techniques so that scalability can also be handled. Using action research, we have conducted three pilots in three Norwegian software organizations. These three pilots have com- pletely different architectures and also operate in different markets, yet have in common scalability challenges. As a result, we describe common challenges for scalability engineering using agile development techniques and we propose the ScrumScale Method which includes scalability engineering in an incremental and iterative development process.;"Geir Kjetil Hanssen; Gunnar Brataas; Georg Ræder";B002
117;Developers' initial perceptions on TDD practice: A thematic analysis considering distinct domains and languages;5/22/2018 3:00 PM;5/22/2018 3:30 PM;Research;;"Test-Driven Development (TDD) is one of the most popular agile practices among software developers. To investigate the software developers’ initial perceptions when applying TDD, we have performed an exploratory study. This study was carried out with participants who had about ten years of professional experience (on average), the majority of whom with no experience using TDD. The study is in the context of an agile project course at the postgraduate level of a research institute. Participants individually developed medium size projects addressed to different domains and using different programming languages. Through a structured questionnaire with open and semi-open questions, we collected information on TDD effects such as the perceived benefits, encountered difficulties, and developer’s opinion about the quality improvement of the software. Afterwards, we conducted a thematic analysis of the qualitative data. Most participants noticed improvements in code quality, but few have a more comprehensive view of the effects of TDD on software design. Our findings suggest that after overcoming the initial difficulties to understand where to start, and after knowing how to create a test for a feature that does not yet exist; participants gain greater confidence to implement new features and make changes due to broad test coverage.";"Tiago Silva; Herez Moise Kattan; Eduardo Guerra; Joelma Choma";B003
119;Teamwork quality and team performance: Exploring differences between small and large agile projects;5/24/2018 12:00 PM;5/24/2018 12:15 PM;Research;;Agile principles were originally developed for small projects but are now widely used in larger projects with hundreds of developers. Teamwork quality is essential in any development work, but how does teamwork quality differ in small and large agile projects? We report from an explorative survey with 64 agile teams and 320 team members and team leaders, from 31 teams in small projects and 33 teams in large projects. For small projects, teamwork quality was considered by both team members and team leaders to primarily affect product quality. For large projects, the effect of teamwork quality on product quality was positive when it was rated by team members but was negative when rated by team leaders. At a finer granularity, the six dimensions of teamwork quality that we investigated affected team performance differently in small and large projects. These findings question to what extent findings from previous studies on teamwork in agile development in small projects apply to large projects.;"Gunnar Bergersen; Yngve Lindsjørn; Dag Sjøberg; Torgeir Dingsøyr";B002
120;Myths and Facts about Static Application Security Testing Tools: An Action Research at Telenor Digital;5/23/2018 12:00 PM;5/23/2018 12:30 PM;Research;;It is claimed that integrating agile and security in practice is challenging. There is the notion that security is a heavy process, requires expertise, and consumes developers’ time. These contrast with the agile vision. Regardless of these challenges, it is important for organizations to address security within their agile processes since critical assets must be protected against attacks. One way is to integrate tools that could help to identify security weaknesses during implementation and suggest methods to refactor them. We used quantitative and qualitative approaches to investigate the efficiency of the tools and what they mean to the ac- tual users (i.e. developers) at Telenor Digital. Our findings, although not suprising, show that several barriers exist both in terms of tool’s performance and developers’ perceptions. We suggest practical ways for improvement.;"Daniela S Cruzes; Tosin Daniel Oyetoyan; Bisera Milosheska; Mari Grini";B217
122;Challenges and Strategies for Undertaking Continuous Experimentation to Embedded Systems: Industry and Research Perspectives;5/24/2018 12:00 PM;5/24/2018 12:30 PM;Research;;"Abstract. Context: Continuous experimentation is frequently used in web-facing companies and it is starting to gain the attention of embedded systems companies. However, embedded systems companies have different challenges and requirements to run experiments in their systems. Objective: This paper explores the challenges during the adoption of continuous experimentation in embedded systems from both industry practice and academic research. It presents strategies, guidelines, and solutions to overcome each of the identified challenges. Method: This research was conducted in two parts. The first part is a literature review with the aim to analyze the challenges in adopting continuous experimentation from the research perspective. The second part is a multiple case study based on interviews and workshop sessions with five companies to understand the challenges from the industry perspective and how they are working to overcome them. Results: This study found a set of twelve challenges divided into three areas; technical, business, and organizational challenges and strategies grouped into three categories, architecture, data handling and development processes. Conclusions: The set of identified challenges are presented with a set of strategies, guidelines, and solutions. To the knowledge of the authors, this paper is the first to provide an extensive list of challenges and strategies for continuous experimentation in embedded systems. Moreover, this research points out open challenges and the need for new tools and novel solutions for the further development of experimentation in embedded systems.";"David Issa Mattos; Jan Bosch; Helena Holmström Olsson";B001
123;Improving Mockup-based Requirement Specification with End-User Annotations;5/23/2018 3:00 PM;5/23/2018 3:30 PM;Research;;Agile approaches, one of the key methodologies used in today’s software projects, often rely on user interface mockups for capturing the goals that the system must satisfy. Mockups, as any other requirement artifact, may suffer from ambiguity and contradiction issues when several points of view are surveyed / elicited by different analysts. This article introduces a novel approach that enhances mockups with friendly end-user annotations that helps formalizing the requirements and reducing or identifying conflicts. We present an evaluation of the approach in order to measure how the use of annotations improves requirements quality.;"Mario Matias Urbieta; Nahime Torres;  Gustavo Rossi; Francisco José Dominguez-Mayo; José Matías Rivero";B001
124;Technical and Organizational Agile Practices: A Latin-American Survey;5/22/2018 5:30 PM;5/22/2018 6:00 PM;Research;;Background: Agile Software Development is widely used nowadays and to measure its real usage we need to analyze how its practices are used. These practices have been categorized by several authors and some practitioners have suggested that technical practices have a lower usage level than organizational practices. Objective: In this study we aim to understand the actual usage of tech- nical and organizational agile practices in the Latin-American Agile community. Method: We conducted a three-stage survey in conferences of the Latin-Ameri- can Agile Community. Results: Organizational practices are much more used than technical ones. The number of practices used is a direct function of organi- zation experience using agile. The difference between technical and organiza- tional practices reduces with the experience of the organization using agile. Team size and project duration seem to have no effect in number of practices used.;"Nicolas Paez; Diego Fontdevila; Alejandro Oliveros; Fernando Gainey";B003
126;Do Agile Methods Work for Large Software Projects?;5/24/2018 3:00 PM;5/24/2018 3:30 PM;Research;;Is it true that agile methods do not scale well and are mainly useful for smaller software projects? Or is it rather the case that it is particularly in the context of larger, typically more complex software projects that the use of agile methods is likely to make the difference between success and failure? To find out more about this, we conducted a questionnaire-based survey collecting information about 122 Norwegian software projects. Project success was measured as the combined performance of the project regarding delivered client benefits, cost control, and time control. We found that that projects using agile methods performed on average much better than those using non-agile methods for medium and large software projects, but not so much for smaller projects. This result gives support for the claim that agile methods are more rather than less successful compared to traditional methods when project size increases. There may consequently be more reasons to be concerned about how non-agile, rather than how agile methods, scale.;Magne Jørgensen;B217
130;Combining STPA and BDD for Safety Analysis and Verification in Agile Development: A Controlled Experiment;5/23/2018 5:00 PM;5/23/2018 5:30 PM;Research;;Context: Agile development is in widespread use, even in safety-critical domains. Motivation: However, there is a lack of an appropriate safety analysis and verification method in agile development. Objective: In this paper, we investigate the use of Behavior Driven Development (BDD) instead of standard User Acceptance Testing (UAT) for safety verification with System-Theoretic Process Analysis (STPA) for safety analysis in agile development. Method: We evaluate the effect of this combination in a controlled experiment with 44 students in terms of productivity, test thoroughness, fault detection effectiveness and communication effectiveness. Results: The results show that BDD is more effective for safety verification regarding the impact on communication effectiveness than standard UAT, whereas productivity, test thoroughness and fault detection effectiveness show no statistically significant difference in our controlled experiment. Conclusion: The combination of BDD and STPA seems promising, but the impact on communication needs more research.<br><br><strong>Authors: Stefan Wagner, Yang Wang</strong>;Yang Wang;B001
131;ICOs overview: should investors choose an ICO developed with the Lean Startup methodology?;5/24/2018 5:30 PM;5/24/2018 6:00 PM;Research;;An Initial Coin Offering (ICO) is an innovative way to raise funds and launch a startup and even as an opportunity to take part in a project, in a DAO (Decentralized Autonomous Organization). The use of ICO is a global phenomenon that involves many nations and several business categories: ICOs collected over 5.2 billion dollars only in 2017. The success of an ICO is based on the credibility and innovativeness of project proposals. This fund-raising tool contains however some critical issues such as the use of token that must have an intrinsic value and does not generate direct liquidity and the role of investors in the management of startup. We analyzed if the Lean Startup methodology is helpful to face this critical aspects and we examined at some ICOs in which the proposing team states explicitly that a lean startup approach is used.;"Andrea Pinna; Simona Ibba; Gavina Baralla; Michele Marchesi";B001
133;Interface Problems of Agile in a Non-Agile Environment;5/24/2018 5:30 PM;5/24/2018 5:45 PM;Research;;Context: Agile is an accepted and widespread software development approach. But there are also still many projects that are working with traditional software development methods. In addition, non-technical business units like human resources or marketing continue working in the established traditional ways. Thus, problems arise at the interface of agile and traditional approach-es due to the fundamental differences of those paradigms. Objective: To prevent potential problems, one must be aware of the existing interfaces and common pitfalls. Method: Based on a literature search, own experiences and interview results, we identified existing interfaces as well as collected and grouped problems. Results: We present the identified problems and propose a matrix that facilitates classification of interface problems. Conclusion: This matrix can be used to identify and classify more problems with the aim of providing an experience base that helps understanding and preventing problems at the interface between agile and traditional.;"Philipp Diebold; Sven Theobald";B002
134;Supporting Large-Scale Agile Development with Domain-driven Design;5/23/2018 5:30 PM;5/23/2018 6:00 PM;Research;;An increasing number of large organizations are adopting agile and lean methods at larger scale for building complex software systems. One major critique of agile development and in particular of large-scale agile development is the neglect of proper architecting assistance in such development efforts. On the one hand, emergent architecture design may require excessive redesign efforts in large systems, while on the other hand, big upfront architecture delays the starting point of implementation. Domain-driven Design (DDD) addresses this problem by providing means for evolving the architecture of complex systems in an agile way. We describe how DDD can support large-scale agile development based on a conducted case study in a large insurance company with three agile teams. Furthermore, we present a framework for large-scale agile development that is largely based on Large-Scale Scrum and incorporates strategic and tactical DDD.;"Matheus Hauder; Martin Kleehaus; Christina Schimpfle;  Florian Matthes; Ömer Uludağ";B001
135;Software tester, we want to hire you! An analysis of skill demands with a focus on soft skills;5/24/2018 5:30 PM;5/24/2018 6:00 PM;Research;;"One important discussion in the software development field is related to the skills that people must have in order to build successful software products. This debate is generated on one hand by a large number of failures and delays of software projects. On the other hand, the debate is triggered by the need to build even better-quality software in a rapidly changing world. We will examine to which extent soft skills are relevant when hiring software testers and if there are any specific skills required for agile testers. We analyzed 400 job advertisements for testers from 33 countries, out of which 64% ask for soft skills. Of the advertisements asking for soft skills, there is, on average, a request for 4.7 soft skills, 11.3 testing skills and 5.3 technical skills. Only 30% of the companies ask explicitly for agile testers. However, our analysis shows no notable differences in skill demands for agile testers and the rest.&nbsp;Software companies want to hire testers who are able to communicate well and have analytical and problem-solving skills. There is a significant increase in the need for openness and adaptability, independent-working and team-playing since 2012. In addition, there are new categories of soft skills identified, such as having work ethics, customer-focus and the ability to work under pressure.";"Viktoria Stray; Raluca Madalina Florea";B003
138;Learning in the Large - An Exploratory Study of Retrospectives in Large-Scale Agile Development;5/23/2018 5:15 PM;5/23/2018 5:30 PM;Research;;Many see retrospectives as the most important practice of agile software development. Previous studies of retrospectives have focused on process and outcome at team level. In this article, we study how a large-scale agile development project uses retrospectives through an analysis of retrospective reports identifying a total of 109 issues and 36 action items as a part of a longitudinal case study. We find that most of the issues identified relate to team-level learning and improvement, and discuss these findings in relation to current advice in a framework for large-scale agile development.;"Marius Mikaelsen; Anniken Solem; Kathrine Vestues; Torgeir Dingsøyr";B002
142;Inter-team Coordination in Large-Scale Agile Development: A Case Study of Three Enabling Mechanisms;5/22/2018 5:30 PM;5/22/2018 6:00 PM;Research;;Agile methods are increasingly used in large development projects, with multiple development teams. A central question is then what is needed to coordinate feature teams efficiently. This study examines three mechanisms for coordination, shared mental models, communication and trust in a large-scale development project with 12 feature teams running over a four-year period. We analyse the findings in relation to suggested frameworks for large-scale agile development and one theory on coordination, and provide new recommendations for practice and theory.;" Christoph Johann Stettina; Julia Wijnmaalen; Finn Olav Bjørnson; Torgeir Dingsøyr";B001
144;Agile Software Development – Adoption & Maturity: An Activity Theory Perspective;5/23/2018 12:00 PM;5/23/2018 12:30 PM;Research;;This paper suggests that the activity theory concept is a useful lens for organisations that seek to improve their levels of agile software development maturity. Attention is focused around the interactions and approaches adopted by individuals rather than the usual process and technique. This paper reports on the initial stages of research that consisted of a series of interviews and a survey. The results indicate that activity theory contradictions are wide spread and vary in the levels at which they occur. They also correlate to many of the factors that influence agile maturity that have already been identified within the literature. This study contributes to research by integrating elements of learning theory and agile software development.;Pritam Chita;B001
151;Enterprise agility: Why is transformation so hard?;5/24/2018 3:00 PM;5/24/2018 3:30 PM;Research;;Enterprise agility requires capabilities that help organisations to transform, sense and seize new business opportunities more quickly than competitors. However, acquiring those capabilities, such as transformation to continuous delivery and scaling agile, are challenging in many organisations. This paper addresses definitions of enterprise agility involving business management and cultural lenses for analysing large-scale transformation. The case organisation, in the higher education domain, leverages collaborative discovery sprints and an experimental programme to enable a bottom-up approach to transformation. Meanwhile prevalence of top-down bureaucracy and organisational silos are often contradictory to agile principles and values. The case study results identify transformation challenges based on observations from a five-months research period. Initial findings indicate that increased focus on culture and synchronised leadership activities could enhance the likelihood of a successful transformation.<br><br><strong>Authors: Leonor Barroca, Teemu Karvonen, Helen Sharp</strong>;Teemu Karvonen;B002
152;COSMIC User Story Standard;5/22/2018 5:00 PM;5/22/2018 5:30 PM;Research;;User Stories is a technique widely used in Agile development. It is characterized as short and high-level descriptions of required functionality, written in customer language during very early stages of requirement gathering and containing just enough information to produce the estimated implementation effort. The COSMIC method is a second generation technique for function size measurement. The requirement estimation precision in COSMIC is directly proportional to the requirement detailing level. The current user stories writing standards may lack important information for COSMIC measurement purposes. This paper introduces a new standard for writing user stories which contain more expressiveness in terms of COSMIC size estimation. We performed a survey to introduce this new user story template to the COSMIC community. The qualitative survey intended to capture COSMIC users opinion in terms of expressiveness and how valuable it is. The survey points to promising results considering the COSMIC users opinion about the new template. This study contributes to agile requirements from the COS-MIC users point of view. This new template may be a step forward in terms of user story estimation for COSMIC sizing based projects.;"Miguel Ecar;  Fabio Kepler; João Pablo S Da Silva";B002
156;Reporting in Agile Portfolio Management: Routines, Metrics and Artefacts to Maintain an Effective Oversight;5/24/2018 5:00 PM;5/24/2018 5:30 PM;Research;;In a world where changes are being higher paced than ever, businesses are required to cope with these changes to survive. Many organizations have successfully adopted agile methods to cope with these rapid changes in their projects. However, a growing number of organizations seeks to adopt agile practices on their portfolio level. A domain far less explored. In this paper we report the preliminary findings of our study on reporting practices, artifacts and metrics in agile portfolio management. Based on 14 interviews conducted in 10 large European organizations this study for the first time provides an empirical perspective on the topic.<br /><br /><strong><em>Christoph Johann Stettina, Lennard Schoemaker</em></strong>;Lennard Schoemaker;B001
166;Automated Acceptance Tests as Software Requirements: An Experiment to Compare the Applicability of Fit tables and Gherkin Language.;5/24/2018 5:00 PM;5/24/2018 5:30 PM;Research;;It is estimated that 85% of the defects in the developed software are originated from ambiguous, incomplete and wishful thinking software requirements. Natural language is often used to write software requirements specifications as well as user requirements. However, natural language specifications can be confusing and hard to understand. Some agile methodologists consider that acceptance tests are more precise and accurate sources of information about the customer’s needs than descriptions in natural language. Several studies have addressed the use of acceptance tests as software requirements specification. Therefore, none of the previous studies has performed experiments to compare the applicability of different acceptance testing techniques in order to support an organization in the selection of one technique over another. This paper addresses this problem reporting an experiment performed with undergraduate students in Computer Science. This experiment compares the applicability of two acceptance testing techniques (Fit tables and Gherkin Language) as software requirements specification. This research tries to answer three questions: (a) Which technique is the easiest to learn in order to specify acceptance test scenarios? (b) Which technique does require less effort to specify acceptance tests? (c) Which technique is the best one to communicate software requirements? The results show that there are no sufficient evidences to affirm that one technique is easier to specify test scenarios or better to communicate software requirements. Whereas, the comparison of effort in terms of time to specify acceptance testing shows that the mean time to specify test scenarios using Gherkin Language is fewer than Fit tables.;"Ernani César Dos Santos; Patrícia Vilain";B003
173;Stress in Agile Software Development: Practices and Outcomes;5/23/2018 5:00 PM;5/23/2018 5:15 PM;Research;;Stress is an important workplace issue, affecting both the health of individuals, and the health of organizations. Early advocacy for Agile Software Development suggested it might help avoid stress, with practices that emphasize a sustainable pace, and self-organizing teams. Our analysis of a 2014 survey, however, suggested that stress might still be commonplace in Agile teams, especially for those with less experience. We also noticed that newcomers to Agile emphasized technical, rather than collaborative, practices, and speculated this might explain the stress. We explored this in our analysis of a follow-up survey conducted in 2016, and report our findings in this paper. We show that there are a variety of factors involved, and that avoiding stress is associated with both collaborative and technical practices, and a range of outcomes.;" Martin Kropp; Craig Anslow; Robert Biddle;  Andreas Meier";B002
26;Lunch Break;5/22/2018 12:30 PM;5/22/2018 2:00 PM;Social;;;;#XP-PX 
